{
  "$schema": "https://json-schema.org/draft/2020-12/schema",
  "$id": "https://atelier.example/schemas/ci/phase_a_gate.v1.json",
  "title": "Phase A nightly gate result",
  "description": "One nightly run of the Phase A gate workflow. Written by .github/workflows/nightly_phase_a_gate.yml to tests/phase_a_gate/last_run.json, validated by tests/validate_artifacts.py on every PR, and read by the `atelier-phase-a-gate-status` binary.",
  "type": "object",
  "required": ["version", "run_id", "git_sha", "all_passed", "gates"],
  "additionalProperties": false,
  "properties": {
    "version": {"const": 1, "description": "Schema version."},
    "run_id": {
      "type": "string",
      "format": "date-time",
      "description": "RFC 3339 timestamp the run completed at. Acts as the natural key for run-to-run comparison."
    },
    "git_sha": {
      "type": "string",
      "pattern": "^[0-9a-f]{7,40}$",
      "description": "Commit the gate ran against. Short or full sha both accepted."
    },
    "workflow_run_url": {
      "type": "string",
      "format": "uri",
      "description": "GitHub Actions run URL for debugging. Optional; missing for local runs."
    },
    "all_passed": {
      "type": "boolean",
      "description": "True iff every gate's status is `passed` or `skipped`. Surfaced separately from the per-gate array so the status binary can short-circuit without re-walking."
    },
    "gates": {
      "type": "array",
      "minItems": 1,
      "items": {"$ref": "#/$defs/Gate"},
      "description": "One row per gate in the run. Order is the workflow's emission order so a reader can read top-to-bottom."
    }
  },
  "$defs": {
    "Gate": {
      "type": "object",
      "required": ["name", "status"],
      "additionalProperties": false,
      "properties": {
        "name": {
          "type": "string",
          "pattern": "^[a-z][a-z0-9_]*$",
          "description": "Stable identifier (snake_case). Examples: `fmt`, `clippy`, `cargo_test_workspace`, `rig_check`, `mcp_integration_npx`, `canonical_priority_subset`."
        },
        "status": {
          "enum": ["passed", "failed", "skipped"],
          "description": "`skipped` is non-fatal â€” used for gates that gate on an external prerequisite (e.g. `npx` availability) the runner couldn't satisfy. `failed` flips `all_passed` to false."
        },
        "duration_secs": {
          "type": "number",
          "minimum": 0,
          "description": "Wall-clock seconds the gate took. Optional â€” older runs may pre-date the field."
        },
        "details": {
          "type": "string",
          "maxLength": 1024,
          "description": "Short human-readable note. For `failed`: the first line of the failure. For `skipped`: the reason. Capped at 1 KiB so a malformed gate can't bloat the artifact."
        }
      }
    }
  }
}
